{
  "schema_version": "1.0.0",
  "event_type": "NODE_UPSERT",
  "event_time": "2026-07-23T10:00:00Z",
  "repository": "huggingface/datasets",
  "file_id": "ef73a9c1b79b71681f6110d07260f0139d34a8c19beccca1dbfc8b34f8bc019c",
  "path": "src/datasets/task6_demo.py",
  "content_sha256": "aaaaaaaaaaaaaaaaaaaaaaaaaaaaaaaaaaaaaaaaaaaaaaaaaaaaaaaaaaaaaaaa",
  "node_id": "bbbbbbbbbbbbbbbbbbbbbbbbbbbbbbbbbbbbbbbbbbbbbbbbbbbbbbbbbbbbbbbb",
  "structural_path": "root.body[0]",
  "node_type": "FunctionDef",
  "label": "FunctionDef:answer",
  "lineno": 1,
  "col_offset": 0,
  "end_lineno": 2,
  "end_col_offset": 13,
  "code": "def answer():\n    return 42",
  "properties": {
    "name": "answer",
    "args": []
  }
}
